{
  "appointment_id": "10345",
  "appointment_datetime": "2011-06-17T08:45:00Z",
  "patient": {
    "id": "42",
    "first_name": "ZAPHOD",
    "last_name": "BEEBLEBROX",
    "dob": "1978-10-12",
    "gender": "M"
  },
  "provider": {
    "id": "1",
    "name": "Adams Douglas A MD"
  },
  "location": "OFFICE",
  "reason": "reason for the appointment"
}